<?xml version="1.0" encoding="UTF-8"?>
<dataroot xmlns:od="urn:schemas-microsoft-com:officedata" xmlns:xsi="http://www.w3.org/2001/XMLSchema-instance"  xsi:noNamespaceSchemaLocation="Effigy.xsd" generated="2019-05-23T09:31:22">
<Effigy>
<ID>1</ID>
<Identifier>AigrefeuilleG1</Identifier>
<Stance>kneeling</Stance>
<Arm_x0020_gesture>hands raised, held together</Arm_x0020_gesture>
<Head_x0020_gesture>upwards</Head_x0020_gesture>
<Attribute1>none</Attribute1>
<Attribute2>none</Attribute2>
<Head_x0020_covering>mitre</Head_x0020_covering>
<Vestments>chasuble</Vestments>
<Direction>half-right</Direction>
</Effigy>
<Effigy>
<ID>2</ID>
<Identifier>Albergati1</Identifier>
<Stance>kneeling</Stance>
<Arm_x0020_gesture>hands raised, holding book</Arm_x0020_gesture>
<Head_x0020_gesture>downwards</Head_x0020_gesture>
<Attribute1>book</Attribute1>
<Attribute2>none</Attribute2>
<Head_x0020_covering>none</Head_x0020_covering>
<Vestments>chasuble</Vestments>
<Direction>right</Direction>
</Effigy>
<Effigy>
<ID>3</ID>
<Identifier>Correr1</Identifier>
<Stance>kneeling</Stance>
<Arm_x0020_gesture>hands raised, held together</Arm_x0020_gesture>
<Head_x0020_gesture>upwards</Head_x0020_gesture>
<Attribute1>none</Attribute1>
<Attribute2>none</Attribute2>
<Head_x0020_covering>mitre</Head_x0020_covering>
<Vestments>chasuble</Vestments>
<Direction>left</Direction>
</Effigy>
<Effigy>
<ID>4</ID>
<Identifier>Adimarius3</Identifier>
<Stance>kneeling</Stance>
<Arm_x0020_gesture>hands raised, held together</Arm_x0020_gesture>
<Head_x0020_gesture>upwards</Head_x0020_gesture>
<Attribute1>crosier</Attribute1>
<Attribute2>none</Attribute2>
<Head_x0020_covering>mitre</Head_x0020_covering>
<Vestments>chasuble</Vestments>
<Direction>half-left</Direction>
</Effigy>
<Effigy>
<ID>5</ID>
<Identifier>Adimarius2</Identifier>
<Stance>kneeling</Stance>
<Arm_x0020_gesture>hands raised, held together</Arm_x0020_gesture>
<Head_x0020_gesture>upwards</Head_x0020_gesture>
<Attribute1>none</Attribute1>
<Attribute2>none</Attribute2>
<Head_x0020_covering>mitre</Head_x0020_covering>
<Vestments>chasuble</Vestments>
<Direction>half-left</Direction>
</Effigy>
<Effigy>
<ID>6</ID>
<Identifier>AigrefeuilleF1</Identifier>
<Stance>kneeling</Stance>
<Arm_x0020_gesture>hands raised, held together</Arm_x0020_gesture>
<Head_x0020_gesture>upwards</Head_x0020_gesture>
<Attribute1>none</Attribute1>
<Attribute2>none</Attribute2>
<Head_x0020_covering>mitre</Head_x0020_covering>
<Vestments>chasuble</Vestments>
<Direction>half-left</Direction>
</Effigy>
<Effigy>
<ID>7</ID>
<Identifier>AlbretL1</Identifier>
<Stance>kneeling</Stance>
<Arm_x0020_gesture>hands raised, held together</Arm_x0020_gesture>
<Head_x0020_gesture>forwards</Head_x0020_gesture>
<Attribute1>none</Attribute1>
<Attribute2>none</Attribute2>
<Head_x0020_covering>mitre</Head_x0020_covering>
<Vestments>chasuble</Vestments>
<Direction>full face</Direction>
</Effigy>
<Effigy>
<ID>8</ID>
<Identifier>Amboise1</Identifier>
<Stance>kneeling</Stance>
<Arm_x0020_gesture>hands raised, held together</Arm_x0020_gesture>
<Head_x0020_gesture>forwards</Head_x0020_gesture>
<Attribute1>none</Attribute1>
<Attribute2>none</Attribute2>
<Head_x0020_covering>none</Head_x0020_covering>
<Vestments>chasuble</Vestments>
<Direction>half-left</Direction>
</Effigy>
<Effigy>
<ID>9</ID>
<Identifier>BarboM1</Identifier>
<Stance>kneeling</Stance>
<Arm_x0020_gesture>hands raised, held together</Arm_x0020_gesture>
<Head_x0020_gesture>forwards</Head_x0020_gesture>
<Attribute1>none</Attribute1>
<Attribute2>none</Attribute2>
<Head_x0020_covering>mitre</Head_x0020_covering>
<Vestments>chasuble</Vestments>
<Direction>full face</Direction>
</Effigy>
<Effigy>
<ID>10</ID>
<Identifier>BarL1</Identifier>
<Stance>kneeling</Stance>
<Arm_x0020_gesture>hands raised, held together</Arm_x0020_gesture>
<Head_x0020_gesture>upwards</Head_x0020_gesture>
<Attribute1>none</Attribute1>
<Attribute2>none</Attribute2>
<Head_x0020_covering>mitre</Head_x0020_covering>
<Vestments>chasuble</Vestments>
<Direction>half-left</Direction>
</Effigy>
<Effigy>
<ID>11</ID>
<Identifier>BarL2</Identifier>
<Stance>kneeling</Stance>
<Arm_x0020_gesture>hands raised, held together</Arm_x0020_gesture>
<Head_x0020_gesture>upwards</Head_x0020_gesture>
<Attribute1>none</Attribute1>
<Attribute2>none</Attribute2>
<Head_x0020_covering>mitre</Head_x0020_covering>
<Vestments>chasuble</Vestments>
<Direction>half-left</Direction>
</Effigy>
<Effigy>
<ID>12</ID>
<Identifier>Bessarion1</Identifier>
<Attribute1>none</Attribute1>
<Attribute2>none</Attribute2>
<Head_x0020_covering>mitre</Head_x0020_covering>
<Vestments>chasuble</Vestments>
</Effigy>
<Effigy>
<ID>13</ID>
<Identifier>Borsano1</Identifier>
<Stance>kneeling</Stance>
<Attribute1>none</Attribute1>
<Attribute2>none</Attribute2>
<Head_x0020_covering>mitre</Head_x0020_covering>
<Direction>left</Direction>
</Effigy>
<Effigy>
<ID>14</ID>
<Identifier>BoulogneG1</Identifier>
<Stance>kneeling</Stance>
<Arm_x0020_gesture>hands raised, held together</Arm_x0020_gesture>
<Head_x0020_gesture>upwards</Head_x0020_gesture>
<Attribute1>none</Attribute1>
<Attribute2>none</Attribute2>
<Head_x0020_covering>mitre</Head_x0020_covering>
<Vestments>chasuble</Vestments>
<Direction>half-left</Direction>
</Effigy>
<Effigy>
<ID>15</ID>
<Identifier>Brunhiac1</Identifier>
<Stance>kneeling</Stance>
<Arm_x0020_gesture>hands raised, held together</Arm_x0020_gesture>
<Head_x0020_gesture>upwards</Head_x0020_gesture>
<Attribute1>none</Attribute1>
<Attribute2>none</Attribute2>
<Head_x0020_covering>none</Head_x0020_covering>
<Vestments>chasuble?</Vestments>
<Direction>right</Direction>
</Effigy>
<Effigy>
<ID>16</ID>
<Identifier>Calleville1</Identifier>
<Stance>kneeling</Stance>
<Arm_x0020_gesture>hands raised, held together</Arm_x0020_gesture>
<Head_x0020_gesture>upwards</Head_x0020_gesture>
<Attribute1>none</Attribute1>
<Attribute2>none</Attribute2>
<Head_x0020_covering>mitre</Head_x0020_covering>
<Vestments>chasuble</Vestments>
<Direction>half-left</Direction>
</Effigy>
<Effigy>
<ID>17</ID>
<Identifier>CampeggioL2</Identifier>
<Stance>kneeling</Stance>
<Arm_x0020_gesture>hands raised, held together</Arm_x0020_gesture>
<Head_x0020_gesture>upwards</Head_x0020_gesture>
<Attribute1>none</Attribute1>
<Attribute2>none</Attribute2>
<Head_x0020_covering>mitre</Head_x0020_covering>
<Vestments>chasuble</Vestments>
<Direction>half-left</Direction>
</Effigy>
<Effigy>
<ID>18</ID>
<Identifier>CapranicaA1</Identifier>
<Stance>kneeling</Stance>
<Arm_x0020_gesture>hands raised, held together</Arm_x0020_gesture>
<Head_x0020_gesture>upwards</Head_x0020_gesture>
<Attribute1>none</Attribute1>
<Attribute2>none</Attribute2>
<Head_x0020_covering>mitre</Head_x0020_covering>
<Vestments>chasuble</Vestments>
<Direction>half-right</Direction>
</Effigy>
<Effigy>
<ID>19</ID>
<Identifier>Carvajal1</Identifier>
<Stance>kneeling</Stance>
<Arm_x0020_gesture>hands raised, held together</Arm_x0020_gesture>
<Head_x0020_gesture>upwards</Head_x0020_gesture>
<Attribute1>none</Attribute1>
<Attribute2>none</Attribute2>
<Head_x0020_covering>none</Head_x0020_covering>
<Vestments>chasuble</Vestments>
<Direction>full face</Direction>
</Effigy>
<Effigy>
<ID>20</ID>
<Identifier>CastiglioneB1</Identifier>
<Stance>kneeling</Stance>
<Arm_x0020_gesture>hands raised, held together</Arm_x0020_gesture>
<Head_x0020_gesture>upwards</Head_x0020_gesture>
<Attribute1>none</Attribute1>
<Attribute2>none</Attribute2>
<Head_x0020_covering>mitre</Head_x0020_covering>
<Vestments>chasuble</Vestments>
<Direction>left</Direction>
</Effigy>
<Effigy>
<ID>21</ID>
<Identifier>Challant1</Identifier>
</Effigy>
<Effigy>
<ID>22</ID>
<Identifier>Chanac1</Identifier>
<Stance>kneeling</Stance>
<Arm_x0020_gesture>hands raised, held together</Arm_x0020_gesture>
<Head_x0020_gesture>upwards</Head_x0020_gesture>
<Attribute1>none</Attribute1>
<Attribute2>none</Attribute2>
<Head_x0020_covering>mitre</Head_x0020_covering>
<Vestments>chasuble</Vestments>
<Direction>half-left</Direction>
</Effigy>
<Effigy>
<ID>23</ID>
<Identifier>ClermontF1</Identifier>
<Stance>kneeling</Stance>
<Arm_x0020_gesture>hands raised, held together</Arm_x0020_gesture>
<Head_x0020_gesture>upwards</Head_x0020_gesture>
<Attribute1>none</Attribute1>
<Attribute2>none</Attribute2>
<Head_x0020_covering>indistinct</Head_x0020_covering>
<Vestments>chasuble</Vestments>
<Direction>left</Direction>
</Effigy>
<Effigy>
<ID>24</ID>
<Identifier>CoetivyA1</Identifier>
<Stance>kneeling</Stance>
<Arm_x0020_gesture>hands raised, held together</Arm_x0020_gesture>
<Head_x0020_gesture>forwards</Head_x0020_gesture>
<Attribute1>none</Attribute1>
<Attribute2>none</Attribute2>
<Head_x0020_covering>mitre</Head_x0020_covering>
<Vestments>chasuble</Vestments>
<Direction>full face</Direction>
</Effigy>
<Effigy>
<ID>25</ID>
<Identifier>EstoutevilleG2</Identifier>
<Stance>kneeling</Stance>
<Arm_x0020_gesture>hands raised, held together</Arm_x0020_gesture>
<Head_x0020_gesture>forwards</Head_x0020_gesture>
<Attribute1>none</Attribute1>
<Attribute2>none</Attribute2>
<Head_x0020_covering>mitre</Head_x0020_covering>
<Vestments>chasuble</Vestments>
<Direction>full face</Direction>
</Effigy>
<Effigy>
<ID>26</ID>
<Identifier>FieschiL1</Identifier>
<Stance>kneeling</Stance>
<Arm_x0020_gesture>hands raised, held together</Arm_x0020_gesture>
<Head_x0020_gesture>upwards</Head_x0020_gesture>
<Attribute1>none</Attribute1>
<Attribute2>none</Attribute2>
<Head_x0020_covering>mitre</Head_x0020_covering>
<Vestments>chasuble</Vestments>
<Direction>half-left</Direction>
</Effigy>
<Effigy>
<ID>27</ID>
<Identifier>FoixP2</Identifier>
<Stance>kneeling</Stance>
<Arm_x0020_gesture>hands raised, held together</Arm_x0020_gesture>